<!ELEMENT robot-configuration (power-consumption-rate, starvation-start-time, min-air-pressure, 
min-temperature, max-temperature, freezing-time, robot-list)>
<!ELEMENT power-consumption-rate EMPTY>
<!ATTLIST power-consumption-rate value CDATA #REQUIRED>
<!ELEMENT starvation-start-time EMPTY>
<!ATTLIST starvation-start-time value CDATA #REQUIRED>
<!ELEMENT min-air-pressure EMPTY>
<!ATTLIST min-air-pressure value CDATA #REQUIRED>
<!ELEMENT min-temperature EMPTY>
<!ATTLIST min-temperature value CDATA #REQUIRED>
<!ELEMENT max-temperature EMPTY>
<!ATTLIST max-temperature value CDATA #REQUIRED>
<!ELEMENT freezing-time EMPTY>
<!ATTLIST freezing-time value CDATA #REQUIRED>
<!ELEMENT robot-list (robot*)>
<!ELEMENT robot (natural-attribute-list?, skill-list?)>
<!ATTLIST robot name CDATA #REQUIRED>
<!ATTLIST robot type CDATA #REQUIRED>
<!ATTLIST robot settlement CDATA #IMPLIED>
<!ATTLIST robot job CDATA #IMPLIED>
<!ELEMENT natural-attribute-list (natural-attribute*)>
<!ELEMENT natural-attribute EMPTY>
<!ATTLIST natural-attribute name CDATA #REQUIRED>
<!ATTLIST natural-attribute value CDATA #REQUIRED>
<!ELEMENT skill-list (skill*)>
<!ELEMENT skill EMPTY>
<!ATTLIST skill name CDATA #REQUIRED>
<!ATTLIST skill level CDATA #REQUIRED>